{
  "$schema": "https://json-schema.org/draft/2020-12/schema",
  "$id": "https://hummbl.dev/schemas/cross-repo-compatibility-manifest-v0.1.schema.json",
  "title": "HUMMBL Cross-Repo Compatibility Manifest v0.1",
  "description": "Candidate producer/consumer acceptance manifest. Acceptance records compatibility, not factual correctness, security, or canon status.",
  "type": "object",
  "additionalProperties": false,
  "required": [
    "schema_version",
    "manifest_id",
    "manifest_scope",
    "manifest_status",
    "contract",
    "producer",
    "consumer_decisions",
    "generated_at"
  ],
  "properties": {
    "schema_version": {
      "const": "0.1.0"
    },
    "manifest_id": {
      "type": "string",
      "pattern": "^crm:[a-z0-9][a-z0-9._-]*:[a-z0-9][a-z0-9._/-]*$"
    },
    "manifest_scope": {
      "type": "string",
      "enum": [
        "partial",
        "full"
      ]
    },
    "contract": {
      "type": "object",
      "additionalProperties": false,
      "required": [
        "contract_id",
        "contract_version",
        "payload_schema_uri",
        "payload_version"
      ],
      "properties": {
        "contract_id": {
          "type": "string",
          "pattern": "^crc:[a-z0-9][a-z0-9._-]*:[a-z0-9][a-z0-9._/-]*$"
        },
        "contract_version": {
          "type": "string",
          "pattern": "^[0-9]+\\.[0-9]+\\.[0-9]+$"
        },
        "payload_schema_uri": {
          "type": "string",
          "minLength": 1
        },
        "payload_version": {
          "type": "string",
          "pattern": "^[0-9]+\\.[0-9]+\\.[0-9]+$"
        }
      }
    },
    "producer": {
      "type": "object",
      "additionalProperties": false,
      "required": [
        "repo",
        "publish_receipt_ref"
      ],
      "properties": {
        "repo": {
          "type": "string",
          "pattern": "^[A-Za-z0-9_.-]+/[A-Za-z0-9_.-]+$"
        },
        "publish_receipt_ref": {
          "type": "string",
          "minLength": 1
        }
      }
    },
    "consumer_decisions": {
      "type": "array",
      "minItems": 1,
      "items": {
        "type": "object",
        "additionalProperties": false,
        "required": [
          "repo",
          "decision",
          "supported_contract_versions",
          "supported_payload_versions",
          "conditions",
          "reason",
          "receipt_ref"
        ],
        "properties": {
          "repo": {
            "type": "string",
            "pattern": "^[A-Za-z0-9_.-]+/[A-Za-z0-9_.-]+$"
          },
          "decision": {
            "type": "string",
            "enum": [
              "accepted",
              "conditional",
              "rejected"
            ]
          },
          "supported_contract_versions": {
            "type": "array",
            "items": {
              "type": "string",
              "pattern": "^(?:[0-9]+\\.[0-9]+\\.[0-9]+|[0-9]+\\.[0-9]+\\.x)$"
            }
          },
          "supported_payload_versions": {
            "type": "array",
            "items": {
              "type": "string",
              "pattern": "^(?:[0-9]+\\.[0-9]+\\.[0-9]+|[0-9]+\\.[0-9]+\\.x)$"
            }
          },
          "conditions": {
            "type": "array",
            "items": {
              "type": "string",
              "minLength": 1
            }
          },
          "reason": {
            "type": [
              "string",
              "null"
            ]
          },
          "receipt_ref": {
            "type": "string",
            "minLength": 1
          }
        }
      }
    },
    "generated_at": {
      "type": "string",
      "minLength": 1
    },
    "manifest_status": {
      "type": "string",
      "enum": [
        "fixture_candidate",
        "declared",
        "validated",
        "effective",
        "superseded"
      ]
    }
  }
}
