{
  "schema_version": "0.1.0",
  "manifest_id": "crm:hummbl-dev:research-source-packet-wave1",
  "manifest_scope": "full",
  "manifest_status": "fixture_candidate",
  "contract": {
    "contract_id": "crc:hummbl-dev:research-source-packet",
    "contract_version": "0.1.0",
    "payload_schema_uri": "https://github.com/hummbl-dev/research-source-packets/blob/main/schemas/research-source-packets-v0.1.json",
    "payload_version": "0.1.0"
  },
  "producer": {
    "repo": "hummbl-dev/research-source-packets",
    "publish_receipt_ref": "receipt:publish:rsp-v0.1-wave1"
  },
  "consumer_decisions": [
    {
      "repo": "hummbl-dev/hummbl-research",
      "decision": "accepted",
      "supported_contract_versions": [
        "0.1.x"
      ],
      "supported_payload_versions": [
        "0.1.x"
      ],
      "conditions": [],
      "reason": null,
      "receipt_ref": "receipt:accept:hummbl-research-rsp-v0.1"
    },
    {
      "repo": "hummbl-dev/claim-evidence-ledger",
      "decision": "conditional",
      "supported_contract_versions": [
        "0.1.x"
      ],
      "supported_payload_versions": [
        "0.1.x"
      ],
      "conditions": [
        "Claim ingestion must preserve source-packet provenance and evidence grade."
      ],
      "reason": "Conditional on provenance-preserving ingestion.",
      "receipt_ref": "receipt:conditional:claim-evidence-ledger-rsp-v0.1"
    }
  ],
  "generated_at": "2026-07-11T23:30:00Z"
}
